{
  "acceptanceCriterion": "Deterministic sorting by deviation",
  "environment": "fixture_only",
  "evidenceType": "synthetic_reproducible_fixture",
  "executionPhase": "SPECIFICATION_PHASE",
  "expectedAccessibilityText": "Sorting a, b, c.",
  "expectedPayload": {
    "availableModes": [
      "count",
      "share"
    ],
    "categoryId": "fixture-category",
    "count": {
      "deviation": null,
      "deviationUnit": "brands",
      "focusValue": null,
      "peerMedian": null,
      "peerValues": []
    },
    "defaultMode": "count",
    "focusExcludedFromMedian": true,
    "focusObjectId": "focus",
    "payloadId": "category-benchmark:F141_015_sorting_by_deviation",
    "payloadVersion": "1.0.0",
    "peerObjectIds": [],
    "provenance": {
      "rawInputSha256": "2e9041b9a4a190435147c915866af3106864d87a870d727e589dafab2c8979b2",
      "sourceFixtureId": "F141_015_sorting_by_deviation"
    },
    "quality": {
      "limitations": [],
      "state": "confirmed"
    },
    "share": {
      "deviation": null,
      "deviationUnit": "percentage_points",
      "focusShareExact": null,
      "peerMedianShareExact": null,
      "peerSharesExact": [],
      "shareExactDelta": null
    },
    "state": "ok"
  },
  "expectedPdfExportState": {
    "canonicalPayloadDigest": "6d496fdaab6d896cd77ff52899032a6b331edae68defaf1d38b6a4f15b80b2b7",
    "consumerCalculations": [],
    "fullList": true,
    "include": true,
    "transientUiExcluded": true
  },
  "expectedUiState": {
    "allRowsPreserved": true,
    "availableModes": [
      "count",
      "share"
    ],
    "canonicalPayloadDigest": "6d496fdaab6d896cd77ff52899032a6b331edae68defaf1d38b6a4f15b80b2b7",
    "consumerCalculations": [],
    "defaultMode": "count",
    "state": "ok"
  },
  "fixtureId": "F141_015_sorting_by_deviation",
  "inputContext": {
    "availableModes": [
      "count",
      "share"
    ],
    "defaultMode": "count",
    "variant": "A_horizontal_benchmark_bar"
  },
  "rawInput": {
    "rows": [
      {
        "deviation": 2,
        "id": "b"
      },
      {
        "deviation": 5,
        "id": "a"
      },
      {
        "deviation": -1,
        "id": "c"
      }
    ]
  },
  "sourceIssue": "#141"
}
