{
  "acceptanceCriterion": "Fold",
  "environment": "fixture_only",
  "evidenceType": "synthetic_reproducible_fixture",
  "executionPhase": "IMPLEMENTATION_PHASE_CHECK",
  "expectedAccessibilityText": "Fold: implementation evidence not available.",
  "expectedPayload": {
    "availableModes": [
      "count",
      "share"
    ],
    "categoryId": "fixture-category",
    "count": {
      "deviation": null,
      "deviationUnit": "brands",
      "focusValue": null,
      "peerMedian": null,
      "peerValues": []
    },
    "defaultMode": "count",
    "focusExcludedFromMedian": true,
    "focusObjectId": "focus",
    "payloadId": "category-benchmark:F141_IPC_002_fold",
    "payloadVersion": "1.0.0",
    "peerObjectIds": [],
    "provenance": {
      "rawInputSha256": "44136fa355b3678a1146ad16f7e8649e94fb4fc21fe77e8310c060f61caaff8a",
      "sourceFixtureId": "F141_IPC_002_fold"
    },
    "quality": {
      "limitations": [],
      "state": "confirmed"
    },
    "share": {
      "deviation": null,
      "deviationUnit": "percentage_points",
      "focusShareExact": null,
      "peerMedianShareExact": null,
      "peerSharesExact": [],
      "shareExactDelta": null
    },
    "state": "ok"
  },
  "expectedPdfExportState": {
    "canonicalPayloadDigest": "9338d3335b227553de5deeff5ab2c135b99cee7c671d9047238a609e4463bb91",
    "consumerCalculations": [],
    "status": "IMPLEMENTATION_PHASE_CHECK"
  },
  "expectedUiState": {
    "availableModes": [
      "count",
      "share"
    ],
    "canonicalPayloadDigest": "9338d3335b227553de5deeff5ab2c135b99cee7c671d9047238a609e4463bb91",
    "consumerCalculations": [],
    "defaultMode": "count",
    "status": "IMPLEMENTATION_PHASE_CHECK"
  },
  "fixtureId": "F141_IPC_002_fold",
  "inputContext": {
    "availableModes": [
      "count",
      "share"
    ],
    "defaultMode": "count",
    "variant": "A_horizontal_benchmark_bar"
  },
  "rawInput": {},
  "sourceIssue": "#141"
}
