{
  "acceptanceCriterion": "Both zero",
  "environment": "fixture_only",
  "evidenceType": "synthetic_reproducible_fixture",
  "executionPhase": "SPECIFICATION_PHASE",
  "expectedAccessibilityText": "Both zero. Фокус 0; медиана 0; отклонение 0 brands; состояние ok.",
  "expectedPayload": {
    "availableModes": [
      "count",
      "share"
    ],
    "categoryId": "fixture-category",
    "count": {
      "deviation": 0,
      "deviationUnit": "brands",
      "focusValue": 0,
      "peerMedian": 0,
      "peerValues": [
        0,
        0,
        0
      ]
    },
    "defaultMode": "count",
    "focusExcludedFromMedian": true,
    "focusObjectId": "focus",
    "payloadId": "category-benchmark:F141_008_both_zero",
    "payloadVersion": "1.0.0",
    "peerObjectIds": [
      "peer-1",
      "peer-2",
      "peer-3"
    ],
    "provenance": {
      "rawInputSha256": "62677561cb8b9cbcfbbe416e63e50e43f02d1cf3a2956d461abe61c39e8afea0",
      "sourceFixtureId": "F141_008_both_zero"
    },
    "quality": {
      "limitations": [],
      "state": "confirmed"
    },
    "share": {
      "deviation": null,
      "deviationUnit": "percentage_points",
      "focusShareExact": null,
      "peerMedianShareExact": null,
      "peerSharesExact": [],
      "shareExactDelta": null
    },
    "state": "ok"
  },
  "expectedPdfExportState": {
    "canonicalPayloadDigest": "067e3cb08e9279c513f39389dd3cc42292d141df47e859dc1b5af8e2753e3255",
    "consumerCalculations": [],
    "fullList": true,
    "include": true,
    "qualityLimitations": [],
    "transientUiExcluded": true
  },
  "expectedUiState": {
    "availableModes": [
      "count",
      "share"
    ],
    "canonicalPayloadDigest": "067e3cb08e9279c513f39389dd3cc42292d141df47e859dc1b5af8e2753e3255",
    "component": "horizontal_benchmark_bar",
    "consumerCalculations": [],
    "defaultMode": "count",
    "mode": "count",
    "nonColorMeaning": true,
    "state": "ok"
  },
  "fixtureId": "F141_008_both_zero",
  "inputContext": {
    "availableModes": [
      "count",
      "share"
    ],
    "defaultMode": "count",
    "variant": "A_horizontal_benchmark_bar"
  },
  "rawInput": {
    "focus": 0,
    "mode": "count",
    "peers": [
      0,
      0,
      0
    ]
  },
  "sourceIssue": "#141"
}
