{
  "acceptanceCriterion": "Exclusivity #49 unchanged",
  "environment": "fixture_only",
  "evidenceType": "synthetic_reproducible_fixture",
  "executionPhase": "SPECIFICATION_PHASE",
  "expectedAccessibilityText": "Exclusivity unchanged.",
  "expectedPayload": {
    "availableModes": [
      "count",
      "share"
    ],
    "categoryId": "fixture-category",
    "count": {
      "deviation": null,
      "deviationUnit": "brands",
      "focusValue": null,
      "peerMedian": null,
      "peerValues": []
    },
    "defaultMode": "count",
    "focusExcludedFromMedian": true,
    "focusObjectId": "focus",
    "payloadId": "category-benchmark:F141_018_exclusivity_unchanged",
    "payloadVersion": "1.0.0",
    "peerObjectIds": [],
    "provenance": {
      "rawInputSha256": "2b520b7f810f2ebdc69fc6dffee1de4a46609e80a04473feaeccd61d699e1898",
      "sourceFixtureId": "F141_018_exclusivity_unchanged"
    },
    "quality": {
      "limitations": [],
      "state": "confirmed"
    },
    "share": {
      "deviation": null,
      "deviationUnit": "percentage_points",
      "focusShareExact": null,
      "peerMedianShareExact": null,
      "peerSharesExact": [],
      "shareExactDelta": null
    },
    "state": "ok"
  },
  "expectedPdfExportState": {
    "canonicalPayloadDigest": "88bf15147441a1f0bf5d72b1070c4bd53fa75a3285874ce3b71f3bc5d1c75c26",
    "consumerCalculations": [],
    "fullList": true,
    "include": true,
    "transientUiExcluded": true
  },
  "expectedUiState": {
    "availableModes": [
      "count",
      "share"
    ],
    "canonicalPayloadDigest": "88bf15147441a1f0bf5d72b1070c4bd53fa75a3285874ce3b71f3bc5d1c75c26",
    "consumerCalculations": [],
    "defaultMode": "count",
    "exclusivitySource": "#49",
    "state": "ok"
  },
  "fixtureId": "F141_018_exclusivity_unchanged",
  "inputContext": {
    "availableModes": [
      "count",
      "share"
    ],
    "defaultMode": "count",
    "variant": "A_horizontal_benchmark_bar"
  },
  "rawInput": {
    "exclusiveCount": 7,
    "exclusiveShare": 0.14
  },
  "sourceIssue": "#141"
}
