{
  "acceptanceCriterion": "Null value",
  "environment": "fixture_only",
  "evidenceType": "synthetic_reproducible_fixture",
  "executionPhase": "SPECIFICATION_PHASE",
  "expectedAccessibilityText": "Null value; state no_data; focus None; median None; deviation None.",
  "expectedPayload": {
    "availableModes": [
      "count",
      "share"
    ],
    "categoryId": "fixture-category",
    "count": {
      "deviation": null,
      "deviationUnit": "brands",
      "focusValue": null,
      "peerMedian": 15.0,
      "peerValues": [
        10,
        20
      ]
    },
    "defaultMode": "count",
    "focusExcludedFromMedian": true,
    "focusObjectId": "focus",
    "payloadId": "category-benchmark:F141_009_null",
    "payloadVersion": "1.0.0",
    "peerObjectIds": [
      "peer-1",
      "peer-2"
    ],
    "provenance": {
      "rawInputSha256": "48686d4d8cc8847084e42aed265f4a4641d7440d1c2da5a505ba368d641e3393",
      "sourceFixtureId": "F141_009_null"
    },
    "quality": {
      "limitations": [],
      "state": "no_data"
    },
    "share": {
      "deviation": null,
      "deviationUnit": "percentage_points",
      "focusShareExact": null,
      "peerMedianShareExact": null,
      "peerSharesExact": [],
      "shareExactDelta": null
    },
    "state": "no_data"
  },
  "expectedPdfExportState": {
    "canonicalPayloadDigest": "41ce1b0841ed729aaf9af49e9f23e0aae2ef232f43dc1f813c6bb714660a8362",
    "consumerCalculations": [],
    "fullList": true,
    "include": true,
    "qualityLimitations": [
      "no_data"
    ],
    "transientUiExcluded": true
  },
  "expectedUiState": {
    "availableModes": [
      "count",
      "share"
    ],
    "canonicalPayloadDigest": "41ce1b0841ed729aaf9af49e9f23e0aae2ef232f43dc1f813c6bb714660a8362",
    "component": "horizontal_benchmark_bar",
    "consumerCalculations": [],
    "defaultMode": "count",
    "mode": "count",
    "nonColorMeaning": true,
    "state": "no_data"
  },
  "fixtureId": "F141_009_null",
  "inputContext": {
    "availableModes": [
      "count",
      "share"
    ],
    "defaultMode": "count",
    "variant": "A_horizontal_benchmark_bar"
  },
  "rawInput": {
    "focus": null,
    "peers": [
      10,
      20
    ]
  },
  "sourceIssue": "#141"
}
