{
  "acceptanceCriterion": "Desktop/mobile semantic parity",
  "environment": "fixture_only",
  "evidenceType": "synthetic_reproducible_fixture",
  "executionPhase": "SPECIFICATION_PHASE",
  "expectedAccessibilityText": "Desktop and mobile semantics match.",
  "expectedPayload": {
    "availableModes": [
      "count",
      "share"
    ],
    "categoryId": "fixture-category",
    "count": {
      "deviation": null,
      "deviationUnit": "brands",
      "focusValue": null,
      "peerMedian": null,
      "peerValues": []
    },
    "defaultMode": "count",
    "focusExcludedFromMedian": true,
    "focusObjectId": "focus",
    "payloadId": "category-benchmark:F141_019_semantic_parity",
    "payloadVersion": "1.0.0",
    "peerObjectIds": [],
    "provenance": {
      "rawInputSha256": "3d77969e1744fe54e64c79ff73def10d941655616f3100d3f373be63342b3d40",
      "sourceFixtureId": "F141_019_semantic_parity"
    },
    "quality": {
      "limitations": [],
      "state": "confirmed"
    },
    "share": {
      "deviation": null,
      "deviationUnit": "percentage_points",
      "focusShareExact": null,
      "peerMedianShareExact": null,
      "peerSharesExact": [],
      "shareExactDelta": null
    },
    "state": "ok"
  },
  "expectedPdfExportState": {
    "canonicalPayloadDigest": "6c1545f6d2d96262acaf54369aebc3b39fde369eaad95fd3196aebb49cbc4a33",
    "consumerCalculations": [],
    "fullList": true,
    "include": true,
    "transientUiExcluded": true
  },
  "expectedUiState": {
    "availableModes": [
      "count",
      "share"
    ],
    "canonicalPayloadDigest": "6c1545f6d2d96262acaf54369aebc3b39fde369eaad95fd3196aebb49cbc4a33",
    "consumerCalculations": [],
    "defaultMode": "count",
    "desktop": "same",
    "mobile": "same",
    "nonColorMeaning": true
  },
  "fixtureId": "F141_019_semantic_parity",
  "inputContext": {
    "availableModes": [
      "count",
      "share"
    ],
    "defaultMode": "count",
    "variant": "A_horizontal_benchmark_bar"
  },
  "rawInput": {
    "payloadRef": "canonical-1"
  },
  "sourceIssue": "#141"
}
