{
  "acceptanceCriterion": "Preserve null rows",
  "environment": "fixture_only",
  "evidenceType": "synthetic_reproducible_fixture",
  "executionPhase": "SPECIFICATION_PHASE",
  "expectedAccessibilityText": "Null row preserved.",
  "expectedPayload": {
    "availableModes": [
      "count",
      "share"
    ],
    "categoryId": "fixture-category",
    "count": {
      "deviation": null,
      "deviationUnit": "brands",
      "focusValue": null,
      "peerMedian": null,
      "peerValues": []
    },
    "defaultMode": "count",
    "focusExcludedFromMedian": true,
    "focusObjectId": "focus",
    "payloadId": "category-benchmark:F141_017_preserve_null_rows",
    "payloadVersion": "1.0.0",
    "peerObjectIds": [],
    "provenance": {
      "rawInputSha256": "3fabb3c2c487913c5ec7754474c0c4ddd3d97badd72f4350f60682f25b1c0c25",
      "sourceFixtureId": "F141_017_preserve_null_rows"
    },
    "quality": {
      "limitations": [],
      "state": "confirmed"
    },
    "share": {
      "deviation": null,
      "deviationUnit": "percentage_points",
      "focusShareExact": null,
      "peerMedianShareExact": null,
      "peerSharesExact": [],
      "shareExactDelta": null
    },
    "state": "ok"
  },
  "expectedPdfExportState": {
    "canonicalPayloadDigest": "4e54d88b2f52fd2a0921fd165befa39fd4b64132f618843e87daade84b481a09",
    "consumerCalculations": [],
    "fullList": true,
    "include": true,
    "transientUiExcluded": true
  },
  "expectedUiState": {
    "allRowsPreserved": true,
    "availableModes": [
      "count",
      "share"
    ],
    "canonicalPayloadDigest": "4e54d88b2f52fd2a0921fd165befa39fd4b64132f618843e87daade84b481a09",
    "consumerCalculations": [],
    "defaultMode": "count",
    "state": "ok"
  },
  "fixtureId": "F141_017_preserve_null_rows",
  "inputContext": {
    "availableModes": [
      "count",
      "share"
    ],
    "defaultMode": "count",
    "variant": "A_horizontal_benchmark_bar"
  },
  "rawInput": {
    "rows": [
      {
        "deviation": 2,
        "id": "a"
      },
      {
        "deviation": null,
        "id": "b"
      }
    ]
  },
  "sourceIssue": "#141"
}
