{
  "acceptanceCriterion": "Conflicting",
  "environment": "fixture_only",
  "evidenceType": "synthetic_reproducible_fixture",
  "executionPhase": "SPECIFICATION_PHASE",
  "expectedAccessibilityText": "Conflicting; state conflicting; focus 12; median 12.0; deviation 0.0.",
  "expectedPayload": {
    "availableModes": [
      "count",
      "share"
    ],
    "categoryId": "fixture-category",
    "count": {
      "deviation": 0.0,
      "deviationUnit": "brands",
      "focusValue": 12,
      "peerMedian": 12.0,
      "peerValues": [
        10,
        14
      ]
    },
    "defaultMode": "count",
    "focusExcludedFromMedian": true,
    "focusObjectId": "focus",
    "payloadId": "category-benchmark:F141_014_conflicting",
    "payloadVersion": "1.0.0",
    "peerObjectIds": [
      "peer-1",
      "peer-2"
    ],
    "provenance": {
      "rawInputSha256": "aaedead0ba7794bc87f0d5ace5787acc70b42b5dd8adc4bc958f4a36c894d546",
      "sourceFixtureId": "F141_014_conflicting"
    },
    "quality": {
      "limitations": [],
      "state": "conflicting"
    },
    "share": {
      "deviation": null,
      "deviationUnit": "percentage_points",
      "focusShareExact": null,
      "peerMedianShareExact": null,
      "peerSharesExact": [],
      "shareExactDelta": null
    },
    "state": "conflicting"
  },
  "expectedPdfExportState": {
    "canonicalPayloadDigest": "43af8a182690e830218b154b3b95918cda5f2a142e25e37d2ef96a4f938048e5",
    "consumerCalculations": [],
    "fullList": true,
    "include": true,
    "qualityLimitations": [
      "conflicting"
    ],
    "transientUiExcluded": true
  },
  "expectedUiState": {
    "availableModes": [
      "count",
      "share"
    ],
    "canonicalPayloadDigest": "43af8a182690e830218b154b3b95918cda5f2a142e25e37d2ef96a4f938048e5",
    "component": "horizontal_benchmark_bar",
    "consumerCalculations": [],
    "defaultMode": "count",
    "mode": "count",
    "nonColorMeaning": true,
    "state": "conflicting"
  },
  "fixtureId": "F141_014_conflicting",
  "inputContext": {
    "availableModes": [
      "count",
      "share"
    ],
    "defaultMode": "count",
    "variant": "A_horizontal_benchmark_bar"
  },
  "rawInput": {
    "focus": 12,
    "peers": [
      10,
      14
    ]
  },
  "sourceIssue": "#141"
}
