{
  "acceptanceCriterion": "Share deviation in percentage points",
  "environment": "fixture_only",
  "evidenceType": "synthetic_reproducible_fixture",
  "executionPhase": "SPECIFICATION_PHASE",
  "expectedAccessibilityText": "Share deviation in percentage points. focusShareExact 0.255; peerMedianShareExact 0.2; deviation 5.5 percentage_points; state ok.",
  "expectedPayload": {
    "availableModes": [
      "count",
      "share"
    ],
    "categoryId": "fixture-category",
    "count": {
      "deviation": null,
      "deviationUnit": "brands",
      "focusValue": null,
      "peerMedian": null,
      "peerValues": []
    },
    "defaultMode": "count",
    "focusExcludedFromMedian": true,
    "focusObjectId": "focus",
    "payloadId": "category-benchmark:F141_004_share_percentage_points",
    "payloadVersion": "1.0.0",
    "peerObjectIds": [
      "peer-1",
      "peer-2",
      "peer-3"
    ],
    "provenance": {
      "rawInputSha256": "cf37fb493bc9cb717a800b9b57143c06202faf747e7d2be0b36bfdb1cb37e60b",
      "sourceFixtureId": "F141_004_share_percentage_points"
    },
    "quality": {
      "limitations": [],
      "state": "confirmed"
    },
    "share": {
      "deviation": 5.499999999999999,
      "deviationUnit": "percentage_points",
      "focusShareExact": 0.255,
      "peerMedianShareExact": 0.2,
      "peerSharesExact": [
        0.1,
        0.2,
        0.3
      ],
      "shareExactDelta": 0.05499999999999999
    },
    "state": "ok"
  },
  "expectedPdfExportState": {
    "canonicalPayloadDigest": "0e156297fdfdf324a8fb4011dc388d87081b7bf9047fc08ffe7cc3d309e4b186",
    "consumerCalculations": [],
    "fullList": true,
    "include": true,
    "qualityLimitations": [],
    "transientUiExcluded": true
  },
  "expectedUiState": {
    "availableModes": [
      "count",
      "share"
    ],
    "canonicalPayloadDigest": "0e156297fdfdf324a8fb4011dc388d87081b7bf9047fc08ffe7cc3d309e4b186",
    "component": "horizontal_benchmark_bar",
    "consumerCalculations": [],
    "defaultMode": "count",
    "mode": "share",
    "nonColorMeaning": true,
    "state": "ok"
  },
  "fixtureId": "F141_004_share_percentage_points",
  "inputContext": {
    "availableModes": [
      "count",
      "share"
    ],
    "defaultMode": "count",
    "variant": "A_horizontal_benchmark_bar"
  },
  "rawInput": {
    "focus": 0.255,
    "mode": "share",
    "peers": [
      0.1,
      0.2,
      0.3
    ]
  },
  "sourceIssue": "#141"
}
